{
  "by_license_class": {
    "allow": 546,
    "conditional": 7,
    "deny": 12,
    "unknown": 2635
  },
  "by_trust_tier": {
    "aggregator-copy": 5,
    "community": 507,
    "official": 1833,
    "unreviewed": 855
  },
  "canonical_skills": 3160,
  "curated_skills": 0,
  "generated_at": "2026-09-28T04:15:16.575847+00:00",
  "index_commit": "0178990",
  "repositories": 36,
  "schema_version": "2.0.0",
  "spec_strict_valid_pct": 0.84,
  "tier1_freshness_p50_hours": null,
  "total_skills": 3200
}
